{
  "schemaVersion": 1,
  "id": "20260815-integration-v2-web-workspace-optimizations",
  "title": "V2 workspace architecture simplification and user experience optimizations",
  "module": "integration",
  "risk": "high",
  "changeClass": "normal",
  "status": "implemented",
  "userOutcome": "Decouple V2 workspace views, optimize model discovery and profile duplication, enhance wide-screen shell layout and sticky navigation, and ensure theme-consistent scrollbars.",
  "allowedPaths": [
    ".ai/modules.json",
    "apps/api/src/v2/platform/plugin.test.ts",
    "apps/api/src/v2/platform/plugin.ts",
    "apps/web/src/v2/V2Shell.vue",
    "apps/web/src/v2/adapters/platform.test.ts",
    "apps/web/src/v2/adapters/platform.ts",
    "apps/web/src/v2/components/V2ToastNotification.vue",
    "apps/web/src/v2/components/V2WorkspacePanel.vue",
    "apps/web/src/v2/components/workspace/AssetsWorkspace.vue",
    "apps/web/src/v2/components/workspace/CanonWorkspace.vue",
    "apps/web/src/v2/components/workspace/GraphWorkspace.vue",
    "apps/web/src/v2/components/workspace/PlayerWorkspace.vue",
    "apps/web/src/v2/components/workspace/ReleaseWorkspace.vue",
    "apps/web/src/v2/components/workspace/ReviewWorkspace.vue",
    "apps/web/src/v2/stores/notification.ts",
    "apps/web/src/v2/stores/workspace.test.ts",
    "apps/web/src/v2/stores/workspace.ts",
    "apps/web/src/v2/views/V2ModelSettingsView.vue",
    "apps/web/src/v2/views/V2WorkspaceAreaView.vue",
    "docs/tasks/20260815-integration-v2-web-workspace-optimizations.json",
    "packages/contracts/src/v2/platform/index.ts"
  ],
  "forbiddenPaths": [
    "packages/contracts/src/v2/core/**",
    "packages/contracts/src/v2/generation/**",
    "packages/domain/src/v2/**",
    "packages/database/src/v2/**",
    "packages/ai/src/v2/**",
    "apps/api/src/v2/core/**",
    "apps/api/src/v2/generation/**",
    "apps/worker/src/v2/**"
  ],
  "nonGoals": [
    "V1 API endpoints restoration",
    "Database schema migration changes"
  ],
  "interfaceRequests": [],
  "acceptanceCommands": [
    "pnpm check:scope",
    "pnpm check:boundaries",
    "pnpm test:coverage",
    "pnpm --filter @living-network/web build"
  ],
  "approval": {
    "required": true,
    "confirmed": true,
    "reference": "user-request-session-goal-round"
  },
  "delivery": {
    "branch": "codex/integration/v2-web-workspace-optimizations",
    "baseSha": "3ccd4969c54ec07bbd5d4bacf0704f2e766890d4",
    "pullRequest": null,
    "commits": [],
    "results": [
      {
        "command": "pnpm check:scope",
        "exitCode": 0,
        "note": "Scope validation passes with all modified files declared in manifest."
      },
      {
        "command": "pnpm check:boundaries",
        "exitCode": 0,
        "note": "Architectural boundaries clean with 0 violations."
      },
      {
        "command": "pnpm test:coverage",
        "exitCode": 0,
        "note": "100% strict test coverage maintained."
      },
      {
        "command": "pnpm --filter @living-network/web build",
        "exitCode": 0,
        "note": "Web production bundle compiled successfully."
      }
    ]
  }
}
